{"ok":true,"dryRun":true,"contractVersion":1,"steps":[{"name":"capabilities","ok":true,"detail":"contract_version=1 operations=19"},{"name":"oop_constants","ok":true,"detail":"nil/true/false/smallint/char constants match gemstone-rs Oop helpers"},{"name":"value_conversion","ok":true,"detail":"plain Value <-> PyNativeValue conversion is stable"},{"name":"config_error_mapping","ok":true,"detail":"missing required GemStone config field username"},{"name":"structured_error_mapping","ok":true,"detail":"GemStone operation eval returned OOP_ILLEGAL"}]}
